tweet	label
lool won ti lu werey yi pa you go carry wetin pass u later we go dey abuse short girls how she wan popo u like this	negative
nithank god i no sabi danceme sef na only today i hear dat kind song	positive
true talk how far naa if you no fit adopt me i fit dey sweep and mop innit	positive
the passenger don shit dia panties wow	negative
i want to apologise ahead for some seemingly ignorant things i may tweet in the future im human pls forgive me blast in my dm na me go use my hand come tl come apologise pls dont do what u did to falilat to me i fit kee myself oo me im not a strong person	negative
if any law student or practising lawyer open hisher mouth here again eehhnn na slap una go receive una oga dem don sell the country	positive
bruh my favs in order bank on it wetin dey sup no fit vex onyeka monsters you made time flies wonderful level up alarm clock way too big real life when i think about it its not even in order i no get fav las las	neutral
all of una wey dey settle mattermake una come heaven ok dem sey angel gabriel don sell trumpet na there we dey go now	negative
god i am so drained feels like ill faint sef	negative
im chilling in my balcony collecting fresh breeze this morning e be like say na wetin i go do today be that	positive
this woman here dey cough like she wan cough out her lungs abegi oh me i don go inside	negative
see this agbero you went to see a therapist for oshodi bus stop or ajegunle where you dey live agberos now know a therapist b b na only baba ijebu dem know	negative
no vex e don through i still get one sweet red go arrange nkwobi join am	positive
happy birthday adaeze billie aka dezibillions my last resort for inquiries on event planning things na madam ndi oga o ji smile e jide umu boys madam kee ebe m ga e meeti gi	positive
aligo abeg help me give akpors hot slap dis morning cus he no sabi anythingi vote aligo joor	negative
people just dey lie on sapa head ‍️ person wey we dey complain about sapa don leave me go cyprus ️ sapa nice one oo️	negative
be like say you dey craze i send you work na because of you dem dey send me condolence message	negative
boss mi i swear i no know how god take create u oo all i know is dat my god will judge u oo al dis good jamzz wey u dey give is non stop	negative
even the man wife dey vex for am e heart na stone	negative
babe make we gather beat dat person wey write dat tweet bcus d tin touch me my left kidneylol	negative
na catfish i do i no kill person saratu	negative
its icons not minding their business for me i hope they wont drag laycon into this nonsense now ‍ while we are here celebrating youre going to step on a sleeping dogs tail i don tire for una sef ‍	negative
i no fit burst for joy finally got her attention	positive
abroad ko abroad ni my account be looking like a hr clock if it was to be an airtime sef i cant even say hellohow far na me abeg call me back	negative
lol warri benin na travel no be all those ones sef its about you being able to live with others it was the first time most of you lived with other guys in the same room and all una gidi gidi na scam i ready rack all of una	positive
a lot gan we even dey demand more sef oloriburuku oshi una no go ever talk true lai lai	positive
when i dont have money i no dey at peace na why i dey sleep	negative
as human no want dey give there babies direct breast milk naso dogs self don innovate into something iconic dem just need the help of humans lobatan bayii vitamincole gamebman	negative
atiku be like saraki dis place go hot ooyou know say buhari no dey dat means say na me go carry lasti no go fit oo saraki baba na true oomake we quick waka comot	negative
covid has done more damage dan good to me dis year d fact dat i wont be able to open my store dis year is so heart breaking whenever i think about it i just feel like throwing myself on d floor while wailing my eyes out its so unfair	negative
kayode kayode kayode how many times did i call you convo is on you dey show us ppl wey dey sleep are u ok like this ‍️	negative
people out here already getting second dose of vaccines and im still here hunting down first dose dem say dem no gems dey give again please epp anybody knows anywhere in lagos i can get the first dose of covid vaccine please kindly refer	negative
its not her first time the boy is strong i fit don die if na me	negative
me i cant wait to leave dis sch na passport be dis abi warris dis one again nsuk wil not kill person haba	negative
yes na na n they took e shock me	negative
rich men are funny men meeting for am casually moved to am and now pm its so funny that im contemplating on waiting here till pm because this house be like say na abroad i dey the ac is not even normal ac	positive
anneath block this woman anneath no gree mumsy viewing anneaths status but this your best friend get swag no be small o me naso i see am o mumsy she don dey do count down sef looking at me like all is not well unlike you wey no get swag	positive
see as the guy bin dey give us that hin mumu smile like tony umez	negative
d kind talk wey dey spit out eh u suppose be course for skool abeg and na first class student i go be ah swear	positive
na project pastor chris sure pass the way i dey look am make i still dey observe am first we go start in months time	positive
uriel don strt wit englishsha go n eat d disgusting food n vomit well cos u don dey practise since	negative
so dis housemates nu fit sidon eat dis chaw ‍️ see as sir dee n tacha pack tins lik say moro nu dey	positive
devil after seeing some humans wickedness devil dey learn where this woman dey let her rot in jail all i care im livid rn	negative
ehweei i go enter old man motor me wey no sabi drive dey even help am control the vehicle his speed is slower than that of a snail and were crawling to my destination ‍️‍️‍️	negative
ssa aiye happy birthday bro just as you are celebrating this years birthday in a new position so shall you celebrate next year in a even better position month don end o wey my share of the salary na i have been doing all pa duties o	positive
after i have abused you you still continue to view this thread wetin you dey fine you dey madd you chop winch you wan die oya geddifok fuck you damn you	negative
heart wey don break like times the seasonings dey heal am	negative
e dey sweet soul abeg	positive
lol wahala for who waste data for babe wey no go fit sub for you	negative
haay god im in tears we got to know each other for the first time yesterday and this morning im already your last hope how biko asking me to pay your friends school fees as as what na why are some girls like this	negative
doga na you i bet withna you dey i dey collect from	positive
e don tay wey i don dey crush on this fine woman not knowing shes a fellow red i knew we had a connection nb pls dont sub	positive
the day you line trip off na that day nepa dey leave light for hours come make you dey feel like jonah of the adugbo	negative
dude i remember in jss i just got into fgc ikirun jjc i no sabi how e dey go i was flashing my bright torchlight at night feeling happy suddenly someone just flashed one weak one in my eyes snatched my torchlight and dropped his own for me i almost cried that day	negative
e don tey wey i kiss sha	positive
fun to chat with don dey bill me k shey bi una say na contact she lost why una no tell me say she lost money too	negative
omo na joke dem de joke here oo	positive
looli don place the order today my account no dey funded like yours fam we dey gather am small small	positive
reebok split sliders color red size uk price n̶ dm to order shakarashop online shop wen sabi you sef go dey do shakara warri nigeria	positive
me sef i want to trend like mbah na should i post my picture na choose anyone that will make me trend like mbah	negative
lol i cant be in that kinda chat ordinary private chat sef i sabi how many bcs and vns i dey receive from my parents every week	positive
where the guy make we ask am how infection dey taste whether e salty or e dey taste lime	negative
this is mee especially when am school i don know wetin i go chop the following week i love food food is bae	positive
take me with youmake me sef experience the orgasmic stuff	positive
na lecturer wey no get happy home dey fix class no week this is my spirit animal but walai i must go i wish i get coconut head for this case but i no get	negative
as we say in pidgin na one time man dey die na abi its better to die with the truth in your mouth than lies i have a better chance of making heaven that way	positive
please what challenge are we doing starting from tomorrow im not doing bigger person again na who dey alive dey fit mature	positive
i don download this abeg app for like months now and i never win any giveaway se na so e bad reach ni abi na only me	negative
come oo next week friday is christmas oo asin im not seeing any sign in my house oo i dont understand oo normally we for don run half bag of flour for chinchin even the meat dey sound like audio	positive
to play sef don dey tire me	negative
papa abeg play like say na your last match you dey play i take god beg you	negative
i go be your super woman oh you go carry me go the alter oh money dey or money dey i go still dey for you	positive
e don dey enter whatsapp love to see it	positive
and na one man go dey chop the sexy girl work like this	positive
im coming wit a bagger very soon e go shock the north inshaallah	negative
na that one we won chop abi make una sign players for us	negative
romance without finance is nuisance abeg imagine dating someone who cant call you and ask you to take two weeks leave so you guys can go on baecation poor people have no need looking for love abeg carry person daughter dey soak garri	negative
old man pa ikhide you sef no chop the wash brf my man all the way plus he didnt sign no cheques	positive
a whole bole to add onions she dey do finger like say na salt she dey put for rice	negative
lol he did it to some of us dat did same na why should we be an exception na haba	negative
de gea don start again o suppose don be now	negative
we love playing around with beautiful fabric d work wey we dey do kellyzafricana	positive
baba u fit follow back na only u i fit fams dont know if u re understanding sir love u gan	positive
make una patronize me na i never chop for days now o why una de do me like this nah	negative
i hate coming to ilorin esp this tanke area you must go broke before leaving how much person get sef wey i they spend like i don make am	negative
i dont believe dis coach again oo we cant even win cardiff and u let herrera go for free solsjkær	negative
this guy no dey hear cut cut cut the babe sef dey enjoy am gan freaky freaky	positive
calling a girl by her isnt always romantic nah una say we no dey romantic we trying to be one una they change story again what do yhu guys really want ehn	negative
wetin dis police people day feel like self nah becos dem carry gun or what time don reach way everybody for naija go carry gun oo	negative
e be like sey una know this guy make una gist us the twitter bird dey hungry	positive
nobody me god talk of detty december sweet stories of i never experredit i never ask e shock me im open to more mehn	positive
i dey look my phone dey laugh my family members dey think say na sweet emotions anyway may jehovah no let them have a mad son bcz of crypto	negative
i hate when i wake up and i dont see that special message m that special one	negative
bro be strong wahala non dey finish me self dey struggle i dey look up dey believe say light go shine soon dont allow a rough patch in your life tomake you think your whole life is worthless you dont judge a whole journey on the basis of one pothole hold on thngs go better	positive
im still in love x s u p e r s u n d a y e v e n i n g w p l a y l i s t c o n t a g i o u s download app	positive
na she use her hand type say she get problem i just dey help identify one of them im happy to help	negative
im not even bothered again sef todays discovery just made me realise im actually doing something great	negative
yeah ‍️the guy wants to trend dat was why e join nysc e cant trend with good music again	positive
las las u go dey alright	positive
lmaoo i swear i no see the tweet wey you dey reply to but i don get now okay nice one	positive
antonio valencia na the first man united celebrity wey don repost us on hin instagram story wow ️ thank you one way	positive
dude the way you dey deliver sub na you build uk subway o	positive
that heart melting allah bless you baby from your spouse please marry ohh e get why	positive
my eating habit is messed up na until my body dey shake like chicken wey get flu before i gree chop ‍️	negative
in this life money is the root of all evilbut you see povertypoverty its the entire fking forest see how grown men and women dey mumu their family name all for k ontop song wey dey cause ear cancer	negative
na lie sef i no dey do again i don see that your picture you go just make me feel inferior	negative
lmao shebi na una wan dey carry mata for head enjoy	negative
o boi today na super sunday o which game you dey look forward to ️ we hope say you go watch am on super sports on dstv lastly if you fit predict the scoreline of both games you go win free airtime from us	positive
dammy we dey raining season o find stone put for pocket maka breeze fit carry you	negative
wetin be my offence	negative
beht beht e be like say na when i fat i dey fine	positive
na wetin make am dey prison so	negative
i fit elbow person pikin this night abeg no near me i dey provoke	negative
bros bless me na my time don reach e no go bad change a life today	negative
pillow under the head wee never allow hair to be smooth laidat na u had to comb or brush it fest but that smile eh lai lo make up‍️‍️‍️ melanin poppin just no wound me abeg na my lane i dey waka so	positive
i hate this man baba sha wan see downfall make una free us na ejor egbon	negative
this makeup fit am	positive
me sef dey pray say make the money come quick oo make guys enjoy how your syd my oga	positive
how many side chicks dem even get so tey na go remains asking for myself ni o	negative
i trust you na na this kind thing you dey like explain	positive
all the good good things wey we dey do for girls our reward na for heaven	positive
ha bros fear god small now see as you finish dembele pesin wey see you go think say you no dey talk but the words of your mouth are nothing but a timed bomb waiting to explode	negative
wow your shoes are nice responses americans i really appreciate your kind gesture britons thank you very much na dem na k you dey see so ooh na dem oh	positive
lmao na so dem take thief my phone i go crash for class wey no get light with chima	negative
but me i have premature belle na im not as old as the folks in the picture	negative
me i fit run the aso ebinah my work be that	positive
i just remembered this girl i paid her tfare this evening refused to gimme number wherever you are rosemary your conscience will judge you o wetin dey even pain me na say she was smiling all through the refusal	negative
jumped my first fence in isl just to attend their socials funny thing is that i wasnt even a student na my mumu cousin drag me go and as i see boys dey use fence audition for mission impossible me sef join	negative
what is wrong wit our leaders in dis country tallest pole	negative
dis is happening in badore road ajah if u see dis tweet kindly retweet so dat d world may see	negative
hehe my guy hustle o dem no dey chop fine boy again	positive
na the body spray and perfume be this oh container don land make una pardon my video quality	negative
add that special red oil pepper sauce join down am with pepsi wen dey sweat and the rapture don complete walahii	positive
tall boys like us na dem dey rush us	positive
see wetin lockdown don cause now ‍️ normally most of those guys no dey do anything for there life before now so dey just take advantage of this lockdown and isolation period to invade people and do there evil work	negative
e go come one day ik no worrye go complete	positive
i swear musa don suffer e be things musa dey see	negative
nah person wey done chop belleful nah e dey think of education	negative
akpors biko if dem see okpa pls make dem chopmikel don score two already	positive
broadband internet service is now in awkaunizik students una lectures na via zoom nowbetter merge in your lodge and buy e go help una ouna fit dey like dey use am	positive
see what na	negative
please what nonsense formula to be hurting someone una no fit comot formula wey go give person joy	negative
the funniest thing is that my grandma my fathers mother is from otoriyede and they never told me that seriake was my elder brother which kain wickedness be dis one nah but h e why did you hide maternal home from us alk this while nah this is sheer wickedness o	negative
good morning baba abeg this days lockdown dey fear me as i dey look my account na only days i go fit survive abeg help your boy	negative
bae wit sauce be my sunshine	positive
if na to dey carry goat upandan nw he go sabi	negative
one hour boys like us we no dey too look for women like that na dem dey rush us	positive
bwahahahahaha na your mates dey do giveaway in this psychological time na book you wan make i go read smh ️	negative
is it until i dress in rags that people will know i dont have money yet and i dont even show off on sm cos i no get una dey make me wan depress say i never get money to help you oo	negative
what happened to all the old praise and worship songs like jesus is alive forever is alive amen no body sings dem againnow is i go dey ff u dey go o ff u dey go o moving with trends	positive
arsenal una dey see una mate see liverpool rush manchester city with fast goallike say them promise extra sunday rice with chicken inside ‍️	positive
over sweet my guy i dedicate today to my dms from till date i don laugh tire our gist back then ehn that short babe suppose dey fine e been end along the line	positive
na demseff dem dey do nah	negative
whos in benin around ugbowo abeg lets link up today id buy my stuff myself if youre a girl make e be say i comot	positive
she didnt even come with her nigga she just looked uninterested and na dem dey trip for the boy pass	negative
how will i read this one sef	negative
na only wetin dey ur head	negative
been a month i havent had noodles e be like i fit kpai if i no chop am tomorrow so much for trying to overcome an addiction	neutral
omo dis fidio go pinis my data oo iyanmii see pesin pikin	positive
and na those dirty guys way dey wear boxer short for days dey like blowjobs pass choi girls dont suffer	negative
lol na this ya guy dey talk say fire service come late to iponri fire when dem com reach hose too short e come say i no get sense on top after i call am out	negative
imo i dey follow one babe talk yesterday my head just dey pain me like pretty babe no go dey smart rara	negative
its a spotlight and im walkingworking on my own tryna dodge all these paparazzi distractions and theres no one to laugh it all out with and ease this life up i know im introverted but this wan fit make man craze	neutral
bros e never still reach you this delivery service tey o no give me red card o i no play betway na podcast i wan do o help me tell am na abeg twitter how far na help a brother	positive
lmfao don dey leak wale turner song too waawuu im just hearing this now wale turner did afrench cover of ycees juice but is still yet to be released not anymore bloggers don leak am	positive
ikorodu delivery this could be your order but you dont love me enough to patronize me shey that one is good like that ehn abi you want me to go back to our village ni	negative
e no matter its his intentions that matters	positive
onye ela dey there na poverty go cripple u dia hehehe	negative
na glo give una chance to dey gimme got spoilers like this	negative
lmafoo na why i dey always use good morningevening maam yes maam for my married exes whenever we dey chat	negative
whos this person always talking about dick on my curious cat please abeg stop e don do	negative
they don come again we go suffer for line finish na made men we go see for house wtf is pick a group leader translate watz in dat card you picked thank youyou will hear from us yet no b say dem collect our details for d room	negative
na all this kind play dey make my future husband dey run im single lets be guided please	negative
e dey always pain person	negative
we go faint with notifications today i don put my phone for silent anytime you post like this my phone battery dey die quick twitter dey shutdown you get force no worry you na igwe	positive
babe head wey neva reach $ worth of btc sef we don de try settle matter since	negative
laslas you fit save money give person wey dey abroad buy for you theyre cheaper their	positive
its dis perception dat beer brings pot belly dat makes some pple not to drink o n dts no good enuf	negative
na cartoon network fit follow dem watch	positive
brymo is a gift to humanity we dont deserve him na society dey enforce the rule but na woman dey dictate the rule but wetin man go do na to break the rule for good what a gift what a blessing what a rendition what a talent i stan a living icon	positive
no dey slander my man pulliz	negative
so all of una wen dei find babe una area and school or place of work no reach again youve finished tasting dos ones o di e gwu	negative
wetin you wan use age do please retweet or geddifok out of my tl	negative
you think say na for ig you go de post ya pictures baa i don crop them and save them pin i expose you here	negative
na ozo dem give strike na him still dey apologize to nergy i wan die for laugh oo	negative
she na like this we go dey dey so many heart shattering news hitting us on daily basis in niger state my heart is broken rn ya allah come through for us	negative
na so just dey top up jameson this very deyi just dey back with and dey observe unclemark for the culture jameson ambassador	positive
e no matter its his intentions that matters	positive
video budget na like m i still dey gather am u fit chill small	positive
bro we lucky say we no dey ghana again dem for don tear our shirt for bru common room cc	negative
abeg make una do giveaway now na my house rent never complete oh	positive
hate when my premonition tells me things and i dont do it immediately now whole breakfast has casted all over the floor who has cleaning company please no be more go do this wahala wit all these oil please who has breakfast let me visit them abeg while they are cleaning	negative
gaskia na true oo why you go like my sister nah when i know wetin you dey do other peoples sister	positive
abeg help me beg maazi ighalo jude make e help my life o i dey suffer gan you too i no mind if you help me o gtbank adeyemi peter	negative
good evening everybody the king is here again something is happening rai na this is the height of it all how can i be going from oshodi to egbeda for over two hours and im still at ikeja im tired im tired	negative
wait till election period lol na there u go know say those whites no get sense he dey sell that american first nonsense to them and dem dey chop am kwa kwa because dem be natural oppressors	negative
toronto raptors in the morning west brom in the afternoon na to go find cake and caprisone this night because my mental health is in the potopoto	negative
after you pour out your feelings and the babe no reciprocate na to just go audiomack or spotify go jam one mad playlist on top bed for big brother house you no fit jam up you go just dey see the babe every minute tears	neutral
im sorry dear but plis dear just face fashion na beg i dey beg oo	negative
e be like say that ogbono soup don dey twist your brain you no fit pick call again abi i blame myself for being lonely and bored eediat	negative
when u wey fine they find rich babe wetin we go con do	positive
can you do a split in the middle too yes you una dey fine who una go tear em yansh‍️	negative
even me sef dey laugh	positive
omo to even run comot sef dey like herculean task what is this life	negative
champions league never start and leicester don dey lose guard alreadylife fit taya them dis year	negative
lmao no be today narain don dey beat vulture tey tey its still the same thank you for banking with us	negative
mgpthe police they sayis your friendbut wait make u enter dem handna dat time u go no weda na true abi na lie dis we naija	negative
ode una no sabi reason u think he will give u no wonder nnamdi kanu dey deceive u people thank god he is late now even in his death una no still get sense	positive
me i no get beards like this so naso dem dey look me	negative
and u sure say no be elebolo ur mama dey do when them mistakenly give birth to u she don pass baton give u to continue from where she end i sure say for here u don hustle for k go again alaye baje	negative
lowokan sha i called orungbe to tell him he said i should cam dan cam dan bawo i was inking my hand was shaking dem thief my gen before that week na candle i dey use the torture jury morning i didnt go o i off phone dey ink for house i was the class rep	negative
mixing and mastering is so damn stressfulyou fit just dey hear some kind breath underneat the recording who dey actually breett	negative
dis is nt ibb sayin dis trash here dis is d handiwrk of satanic hackers	negative
yansh be trending all of a sudden as i no kon get yansh laidis wetin i go do	negative
omo x shey vpn dey make phone hot my phone fit smooth your sunday outfit like this oo	negative
hello na she be this na sha wan spoil the trend	negative
the person fit dey expect something and as the thing never land na why d person never fulfill the promise ️	positive
werey come here na cos na okoto u dey talk since	negative
