tweet	label
i played straight from my heart for this taxify driver when the song finished he said abeg you fit play that your straight from my belle song again abeg i really feel that song	negative
you no go wan hear sef the kyn gist wey dey there	negative
fine girls like us na dem dey rush us	positive
e don tey wey mosquitoes bite me like this and the night is still long and full of terrors	negative
i just dey waka on my own ohh you too get wahala	negative
seriously i miss bhadooski his tweets and his mind your business lifestyle e get some influencers her e wey they like drag person unnecessary	negative
see ehn i no dey beg mek anybody follow me like or retweet my pictures but abeg mek una help my ministry retweet my hustle e take too much grace of god for me to bounce back bikonu retweet my pinned tweet please	positive
realmadrid will surely approve dat we de fan will surely be wit u on hazard up up upde galacticous	positive
person go dey owe you money but go dey launch new footwear if you wan wear am match for the protest wahala no dey but if otherwise you better pay up as we dey your nonsense behaviour must end too period	negative
unbeatable starworld thanks for the patronage honey bunch my abuja pepper dem hang owambe ladies where una dey o	positive
i dey on top water as i dey like dis i dey fear	negative
anambra branch wants my to verify me una dey mad utunnukeep ur verification wait who contacted you he say na thank you for contacting us magodo gra phase ii	positive
e rora mu orijin lale yi sha una dey drink snr drink like water hmm	negative
make wuna stop dey like my tweets e dey make me think say don send me money i take god beg wuna i no want heart attack	negative
my problem with uniben was the level of washing you go see where strong man go dey hail you wey no be anything master master your boy is loyal my chairman i greet you oga carry your number status comot for here before dem follow off me	negative
for your paintings and general interior from walls to floors to ceilings to blinds im the best hustler at it na me be director who dey breet	positive
but this guy is fine sha e con sabi snap again	negative
where una dey see this love make una remain small dash me na	negative
bro abeg leave arsenal analysis na shebi you dey support manu abeg leave trash for lawma o	negative
abeg do your edit na this option i use chop the last time banks share am	positive
in nigeria its a crime against humanity to be fine and broke any small thing as you fine reach no money for pocket naija don taya me abeg i dey go my	positive
neo thank you for telling biggie ozo wasnt whispering for those saying my guy is not focus e shock una abi as ozo said he is here to win and nothing more we go shock una finally in day	positive
man wizkid is fucking good dey chop beats like say na hot akara	positive
wow wahala don reach kada be that na	negative
na wetin kill unai emery be dat no be say e too bad as a manager he was simply sacked because of good ebening	negative
una too spoil any small thing una wan naked clothes nor dey stay una body sef	negative
anytime i see begging a woman for forgiveness in movies e de do me one kain thats how ill be shouting chai chai he begs like hell die if not forgiven his nwirinwiri is too much	positive
abeg leave burna sometimes na so high grade dey make use yarn okoto na we we know	negative
safejo dey court keh quadri no know quadratic equation ifemide never see toaster them don carry innocent go kirikiri oo them say oreofe no chop benefit kofo gan self ti shofo	negative
i dey try my best i open fridge see one hennessy i remain inside cup naso i down am straight omo e hold me for neck but e go soon clear	positive
honestly i must commend you for the rubbish bread we were served call pizza your branch which is located at abule egba lagos nigeria is nothing to write about omo i just wan cry ontop money wey we use buy the bread called e pain me oh	negative
nengi you be better pikini love thé wey u dey follow you nd néo to the bank abeg congratulations inadvance	positive
credit to iamkingrudy trending on youtube worldwide link on my bio dear dem don dey reason with me repping uniabujagwagscity federal	positive
sur kini survey firm pele oo i can imagine me wey dey work for bank sef if customer carry us waka like this i go dey cry inside ni	negative
ahh ig vendor don use me catch cruise but i paid for a green dress na vendor sorry ma no vex this one is fine too e get high slit for front like the green e go fit that your small waist i want to fightt	negative
dem no go hear now o na wen e don dey be like say e wan dey late na im them go con dey shake body like na them do pass yeye pipu	negative
na so we comot wedding wey we no chop wedding rice thank god for the igbo food vendor down the street all the way from akure to lagos no wedding rice to eat	negative
i want to slide in this girls dm on ig but she has like followers abeg how una dey do am me wey i no get yarns i give up	negative
nobody me god talk of detty december sweet stories of i never experredit i never ask e shock me im open to more mehn	positive
someone said what an elder sees sitting down fit b nonsense omo we don vex im here for all of it	negative
this idiot don carry for illorin on number of occasion i cant stop counting oga friday thats is foolish name na f division i sabi am wella	negative
coming from a person i know is extra brilliantnow im scared egbon dat slot still deysebi im your brother too may allah ease for you your affairs	positive
karius was woeful biko ahn ahn e be like person wey nor dey chop protein	negative
don jazzy don dey trend pass coro lol anywhere don jazzy say pim laidis comments section go bust ni donjazzy ma pa wa na	negative
era for slayqueen don chill na level now make we sef do our shakara till this year end na pana all my guys out there fine boyz like us	negative
boys dey hospital dey work salah meat just dey pass patient come and join me doctor me im fine maam thank you	negative
aww thanks a lot man na the prayer be that o make e end well baba me sef dey learn oo see how you just dey make me blush	positive
bros you do make up for your face see as e de shine	positive
na we sabi wetin we dey see	positive
dis guy just dey jaye ori e like say tomorrow no dey again pls god when‍️‍️‍️	positive
e no come again	negative
wahala for who no order grilled catfish from lavonne oo catfish toh gba phd na fried dodo be the follow come dont worryyou can still order for tomorrow o callwhatsapp ota lenuperfectly seasoned steamy hot haiigod na catfish dem go take kidnap me laslas	positive
this country na indian film i dey uar dey tweet from zambia	negative
tike don reach na why u dey wake up by am dont worry in d next yrsu will wake up to see the cute baby diva when u wake up by am	positive
we that have rough face sef we are grateful	positive
coming back to the original topic women are bread winners yes but even at that body dey still gist the guys say them dey fuck hence the depression because low key your guys wont rate you any body that frequent bars a lot where guys talk can relate to what im saying	negative
god ‍️ two bowls of ofe akwu plus goat meat wey dey inside i gave the boy living with me to warm so artisans wey work for my house go use chop cups of rice wey we prepare the boy burn everything to ashes ‍️	negative
nah true love na for facebook e dey i dey go reply messages now	positive
when i wan get money sef i need to know	negative
person dey beg me for money because of tl joke part of the reason why im taking this social distancing and isolation seriously is because im very broke nobody should mock my situation this morning please	negative
like where i wan dey see k monthly where i dey work	negative
lmaoo make e no be like say him no talk	negative
dstv nigeria go host live watch party for their instagram page by pm today the hosts na and ️ make sure you watch am as you fit win big prizes from	positive
frankly i dey enjoy am cuss no dey pain me at all i be warri boy wey go military school cuss na compliment	positive
lmaowhy re u like this na u wey don chop life finish for ur area	positive
i hv sha learnt my lesson im not doing tutorials or telling anybody answer again this second degree and masters make everybody mind their business but e pain me e pain me oo	positive
baba i for like follow you ansa as edey my mind oo but sha dem no count our chips dey plenty de client bin dey in a hurry and we had to send the first chips we added more later hope i dong enta your good book now	positive
‍️ i still dey laugh	positive
mosquitoes on silent they will be flying around your head and you wont even know so much for just bite and go na that their noise dey pain me i no fit use am as excuse again mosquito don dey put themselves on silent if them wan enter flight mode oohh	negative
good morning kemi of course my fellow woman would tear me down me wanting to pick from a range of men to make friends is now a crime secondly me wanting the man to pay all the bills on dates is now a crime lmao if that makes my tweet smelling make e dey smell dey go	negative
only one any other one is a counterfeitif e no be mike e no fit be like mikea fave like no other	negative
haba exams that has made you avoid a fellow ogoja brother for this long congratulations big brother more more more to come how we celebrating na make i buy you beer na abi you no dey drink like me	positive
your papa dey crazebut thats not important rn una dey behave anyhow for this app	negative
coach shay you will enter and play the rest you just dey say calm down since and dem dey flog me	positive
the kind message wey i compose for this woman birthday whats this love turning me into love wey dey inspire	positive
lol alcohol don dey enter dia body	negative
belle don dey pain me again how long will i live with this pain lai shey cramps	negative
i just dey vex i just dey quiet make e no be like say na bad belle dey do me	positive
tomorrow th october makes it one month won the grand prize you don dey chop the money or you wan invest am i fit help you double am oh	positive
you dey beat me for fifa dey tell me bro your hand strong na the team no good	negative
i dont even know where to start from koz my parent love that show like and nah night them dey watch am so sometimes i used to be like why cant they show this thing at morning i dont even know how to express my selffeelings towards this show abeg i just dey type shit	positive
my bro replied wetin happen i call you tire switched off i even come use microphone dey shout for manuwa busstop say if you know madu onyinyechi for banking rd year abeg tell am say i dey find am o people dey pass dey laugh me	negative
they say out wit old and in wit newbut im not letting go of good friends like uthank u for being an incredible frndtank u so much for affecting my life positively this year n the past yearsgod bless and be wit you allu r loved by me	negative
regrann from tundeednut ladies and gentlemen we cannot get enough of this hottest slang na dem dey rush us and we no get choice but to rush una too to order your finely made t	positive
lol dem too dey form and las las nah dem dey marry	negative
better all those figures they are generating if u never dey vex reach na the suffer level we go dey oh	negative
when u love someone they will be using you to do shakara but boom as feelings no dey again na dat time dem go begin catch their own feelings this life sef‍️‍️‍️	negative
you deh pay your babe school fees yet you never write jamb ohboy you be scholarship board uncle check ur dodo e dey burn	negative
dem evict am e still dey do i love you tueh god forbid	negative
customer ill like to rewig my old wig and change it to a blonde bob me say no more na the work wey we dey do	positive
everytime i see this girls tweet im like werey sheyav tweet nonzenz once again e no dey ever get head rara and na chimmy best girl o	negative
okrika wey pass okrika na me be this check out the quality and design correct top lime this you fit wear go anywhere oya follow the process below️️️️ slay on budget shop	positive
the way dj spinall dey always shake him head like say e wan komot	negative
normal people for this country na depression dem dey fight	negative
werey wan use opportunity chop kiss na slap end am	negative
in wizkids voice hey sexy lady i want you in my life i want you to be my wife o baby girl just you and i o my baby you too fine oo you dey make me dey lose my mindskrskrskr fuel don finish	positive
na because of people like una una zombie president use pursue twitter	negative
ken no fit make heaven sha	negative
send me your account number make i wire the balance wey i wan give you for my show wey you come yesterday	positive
awon china ti je eso ajara na china chop meet the whole world came dey wash hand nawa	negative
if he like he sign de buryen kante haaland man dat man must go he have destroy our club to the extend that even qualitie players wont fit in‍️	negative
you too fine abeg na pesin pikin be dis	positive
tbh dis stat is funny diethrough balls wey i fit give like in a match dont understand abeg	negative
this one willie obiano just dey position road roller machine motor grader for different parts of the state shey na make e be like say him dey work osodieme ga machi kwa ya nti ozo	negative
he wasnt live oga na de ow brixton performance u de talk say na live	negative
happy birthday bro god shall continually enlarge your coast after the order of jabez in the name of jesus i no far from you na i dey igandoikotun anytime we fit link up	negative
your mama na killer we go find all of una na just time good morning	negative
guy i wan die that day i come dey waka like say i get hunch back	positive
tacha has forced me to start carrying bottle water everywhere i hear its a massive boost for a smooth skin yet nigerians couldnt even see that positive thing about her o but na to slander and insult her una sabi try looking at the good sometimes	positive
i swear ladycare that year do me strong thing for this life shaade shifting de dragging were i have to be fighting with my pant publicy all in a bid to be at least comfortable while losing blood eww god e be tings for this period hassle wey guys wan troll us on top️	negative
so painful i could only help someone with ah but when did i turn to this na my village people make una leave me na abeg i need money enu gbe please	positive
e don tey una dey poto poto a whole cjn was removed by an experte order sans were rolling in the mud in support	negative
e be like i don enter gbese oo i don go mistake buy new cycling shoes fizik tempo r overcurve in gunmetal	negative
as she dey waka inside bush ‍️ person come fire arrow e come chuck her for back so tey e comot for her chest ‍️ blood come dey comot she come fall for ground e be like say the thing dey pain am well well na im she come dey cry all the birds wey dey there come begin dey fly	positive
na so me sef shock dear na me fuck up sha	positive
go and do your research you don travel out of your state before if nor be say we dey stan thesame mcm u for chop slap for telling me shut up you think say flavor na olamide mate for music	negative
inspecting what please e be like say na years them take swear for abia state	negative
i hate it when i say something meaningful and pesin comment rubbish me no better thing dey to chop for this kitchen pesin chop bread bread na better thing iffah reason you	negative
e y e t e n t i o n never have i seen a blue eye shadow look soo gorgeous all thanks to lacici x available kano st yanga	negative
you people should try and be calming down make e no come touch us wey dey supporters club like this	negative
my own question for pregnant women before person pikin get belle for me be say why una dey scratch under abdomen till he black with craw craw and they spit for wall up and down or na me just see my neigbour like this	negative
prevention is better than cure but this lock down no go work because na wen man comot na him man go chop this post is for those politicians just like una gave us rice salt and made tshirt during campaign	negative
this una own na to dey terminate channels without putting up a replacement in the past months yall have terminated like channels without a replacement yet man pikin dey pay the same subscription rate now yall want to terminate vuzu channel too	negative
naija no fit give us k naira so far you have bvn youre rich	negative
i wan use am take ponder on wetin dem teach for church today b	positive
i claim the money ijn oya wetin be her handle	positive
guy if na me im sha raising brim and stones in your school o lol how im paying m and you dont know or didnt think to inform me beforehand that my son has already chosen his path and its not school	positive
he dey happen na na highness	positive
they will just troll chale into forbes e go get last laugh lol	positive
hello fam a pleasant morning to you its time to catch a glimpse of some of our team dont mind us like say una wan go use us collect money for bank anyhow wey im be sha see some of us one day ehn una go	positive
haha no dey loud am now i don dey sabi small small	positive
lmao my secondary school no fit even do that sco whatever thing i doubt say we reach wey dey active for twitter d skul ratchet as hell zero boujee standard for that ends na only biola dara sochima and muyiwa dey this twitter as far as im concerned	negative
lmao me wey i no dey north i dey go back to that stupid place	positive
unnecessary rudeness sef daz y im always a bitter leaf to them sha im hausa too	positive
ive already boned sef	positive
dele momodu and terry waya dey plan wedding kidd dey catch cruise now ship don strong erica	positive
money i just make e don comot to fix fuel pump whats all this na like why god why like why dis	negative
omo that match wey i bin don equalise only for u to score the th i wan crase i just happy say u win that round cuz if not we fit still dey play go	positive
omo na only god know wetin this woman put for his chocolate pancake love just dey worry me since	positive
las las obi cubana no get female friend wey dey spray money all of them just fold hands dey do like fowl	negative
guy relax dont be too ideal here the streets are toxic and people want followers second not everybody like the guy third e get one girl wey i wan drag because she just dey post rubbish yesterday	negative
this lingard wey una dey start hope say e no go make us cry see ehn we don too make mouth please win	negative
goddy those peeps they make me para na only dem we never finish sadau own hisbah dey there jumping on saudi arabia king again cos of handshake	negative
even me as a guy i was really offended when i saw it check well e fit be say na woman way bring out such tin	negative
ohh which team be that abeg i just dey enjoy una match bro	positive
and so e no gree again na na una dey pained sef shebi na just ordinary feature from the king	negative
all of una wey dey tell me say una love me make i no see una for my dm again oo	negative
barka de sallah im sending down your own meat abeg cue in awon temi by for my goons	positive
lool na too save up comot this country last last i fit just marry oyibo collet green card	positive
people will smoke what they like and come to the tl to start capping rubbish no african rapper can touch the helm of nasty cs garment you people did not even see any nigerian rapper to use and compare its laycon bbnaija fans no go fit kill me	negative
the way dem go drag this guy this season ehn sometimes it is players wey dem don too rate like this that makes that messi not playing in the epl argument kinda valid lool	negative
so nysc sent some female corp members to my place of work and i am supposed to interview them lol me wey no get sense and they get nyash interview never start but i don accept dem already	positive
sad ffs i no fit even type properly what is this life	negative
fine boiz like us na den de rushus twining with d bruh who rocked it better lagos nigeria	positive
see how small boiz dey play sha e dey sweet me oo	negative
i don see lot of men but na only you you smile the brightest as e dey goi go dey love you my baybe	positive
abi na only me dey experience am since dis november guys wen dey disturb me don reduce ooso na so we go dey dis christmas sef	negative
im scared to take this loan from my sister her terms na die like im your baby brother oh this girl	negative
someone told me im better with male friends than females im beginning to concur to that o is like na true o	positive
pls id start sharing my vlog and thought leadership stuff here soon abeg make una dey epp me retweet so my future children go fit chop thanks and god bless u	positive
when we dey tell dem something dem go dey yarn dust england is the best league yen yen yen	negative
hell yeah im a straight up amazing person mixture of craze intelligence and the love of christ why wouldnt i love me plus i never see person wey dey ever ready to improve on themselves like me ️	negative
the rich mans joke is always funny if a celebrity tweets only an alphabet una go still like and retweet am your guy don tweet times today you never like but help me tell your guy e don do only him tweets today	negative
me i cant wait to leave dis sch na passport be dis abi warris dis one again nsuk wil not kill person haba	negative
mummy ire naso naija be oo when u r hungry not even ur family is dere for u but wen u blow and become rich and famous that uncle and aunty wey no help u go dey shout up and down say shes my daughter inside life	negative
these girls must be drinking some special kinda water down southloving this glow loving this sass chai roast us small small with dis una swag abeg we are your sacrifice chai	positive
lol una matter dey make me laugh here that bro dey para for you	positive
man no dey ever use hin credit call me again na xoxo whatsapp every time	negative
hakarat don come again with another ogbonge league party come and chill play and chop money as you dey play snooker for our lounge	positive
omo e be like say una go dey talk this thing till una die oo i bet you might even tell it to your childrens children yall just pained that he has come this far even outstayed your fave nonsense	positive
chelsea banter go too sweet today na dem dey mock messi pass japanese enyimba	negative
the fleet feature is sweet small sha e be like say jazz don dey catch me	positive
steady lightnigerian nepa whatif dat happens den i jus might believe d world wan really end o	negative
mdcn fwacp nma no go see this one na to shamelessly increase primaries to k they sabi yeye dey smell for sabo	negative
lmao this na just noodles na but which kain egusi you cook wey dog no go fit chop	positive
so this new v bank has been trending and i don open new account whats next make una reason my matter na as god go bless una times thankio	positive
nepa off light fan never finish dey turn i don sweat finish i comot outside hot inside hot after facing all of this i cannot come and go to hell again oohh	negative
allah ya isa auto refresh i just saw something and was about viewing profile now i no fit see am again	negative
he de fast de answer	positive
i dey wait for client come see this woman with plantain buns bruhh i don pack am e don tey i had plantain bun and e soft die	positive
thugs don turn inec officials see as dem carry ballot papers like say na dem get am‍️ nigeria my country	negative
yesterday was a movie your babies chemistry im not sure you will understand sha but i enjoyed myself mr intentional was on duty they feed me yesterday na i say make i give una small	positive
i dey site they hustle you dey bill me untop k wey manager never pay me	negative
bro be strong wahala non dey finish me self dey struggle i dey look up dey believe say light go shine soon dont allow a rough patch in your life tomake you think your whole life is worthless you dont judge a whole journey on the basis of one pothole hold on thngs go better	positive
paddie mithanks for your patronage always wahala for who no dey chop lavonne cuisine oo	positive
ah tobi if you dey abuja e don finish for guys	negative
to be honest if all of them dey inform una suppose fit win league but i no wish una well	negative
imagine fine boyz are being paid salary in nigeria so na so i for still dey broke dey go	negative
true talk how far naa if you no fit adopt me i fit dey sweep and mop innit	positive
i don spark am how i fit make una manage am happy new year	positive
wic kain holdup kon dey dis kubwa express like dis me im famished edakun	negative
god pls show me mercy i have suffered enough me not asking much but to escape to us na my mates dey dia and i wan join them see frontja no get light as i dey type this abeg do am for me	negative
swipe ️‍️ geo print asymmetric jumper color brown price n̶ ️ dm to order whatsapp shakarashop online shop wen sabi you sef go dey do shakara warri	positive
hospital visit my next hospital visit na when my wife wan born sha i fit dey outside the compound sha amen	positive
but seriously all these females oap in enugu need to stop all this plenty english when theyre on air️ e no fit some of una at all	negative
you fit change the situation so no more punishment	positive
na una type de run like never before	positive
lol na small e dey start nau no harm in trial	positive
a we get jobs b we dy suffer pass a guy them don cut ya hair for assembly a guy we dy cut grass for here sef b e pele rich gang problems a doh ya papa no get money b nothing lasts forever tearss b na me tell you make you disobey small rules and regulations	negative
omo person fit marry woman based on how beautiful her breast is	positive
ronaldo we wey know am wella know say na fraud your goat no get goatti he no fit carry team turned a team that was winning the double comfortably to a team that is now doing singles like an upcoming artiste	negative
