tweet	label
my shirts will take over lagos soon you can already bear me witness my fans dey feel me everywhere i go even some of my friends dey feel me but dem dey pretend like say dem no too know jollof boy will take	positive
e con be like say i no even dey do anything	negative
when i said lagos people was broke and noisy una wan slap me through whatsapp wetin concern rich person and okada humble yaself and trek	positive
jazz boys where una dey na this whole story is just upside down and inside out lol the worst part is that some of you are now thinking that palm jazz go work for una please refrain from supporting any adulterated suggestion that jazz go work for you by believing it	negative
me wey buy self i dey regret why i waste take buy am e be like na chips wey spoil them use	negative
walahi talahi aj na confirm clown why be say each time pulev dey ready to attack himthat is when e go hold him like say dem dey hug e get why sha	negative
im sure you guys had fun but youre not showing me pics of the oba na all these men with big belle you dey post	positive
ahswear not only that my dear i even thought bida was moved from it original location self the journey no wan end e come be as if na one state i dey go	negative
but e no go better for arsenal sha only them spoilt my beautifully cooked odds something k for don dey ready to sit for my acct now	negative
she go touch lión tailtrust me e no good to find dis guys trouble we dey cool dem down dey are well informed na my ppl dem no dey tire aunty no important na wetin dey vex them	negative
you do giveaways everyday you didnt pick me you asked for peoples account numbers you ignored me you reply some peoples dms you no reply my own you said we should ask you anything i asked for k you no even reply wetin i do nah	negative
thanks dear not like theres anything to be happy about sef	negative
omo i just dey remember say i shazam song wey been dey play when i won buy bread and egg from aboki yesterday i see am for apple music and i jam am i think ive lost it	positive
ur sonmy nephew decided today is arabic speaking day ooh were doing islamiyya im ashamed of myself ur girl no sabi wetin e dey talk na to say toh ina zuwa but las las im proud of him	positive
daddy wike good morning abeg forgive us our sin knowingly or unknowingly abeg na god we take beg u day wey be like say na month inahi wike abeg jx go house to house see wetn dy happen baba u go jx cry release us	negative
you dey win and you dey bring in mane wey go wan score hin own wetin ole do to klopp na	negative
lmao dey dere dey guck person wey get cars for lagos dey stay rented apartment undull	negative
my people no dey disappoint	positive
if una like make una dey fight over banter my beans must not burn	negative
wetin be this abeg	negative
that person should be ready to be seriously disappointed he wasted money on jazz e be like say ordinary swear don catch this one tey tey	negative
you ever cook something so amazing that even you sef dey greet yourselfchaii gbagbe yvonne you sabi jollof rice no be small	positive
lmao una too dey beg see una life	negative
you na boss already wetin u wan learn again	positive
the film makes sense die the action na selense them just dey shoot people dey jump building the fight ehh chai e too sweet e get some people dem no dey die and them dey helep people but one man con betray them sha but the new recruit wey no dey die con save the others	positive
mtcheww una never see anything make i start dey date i go dey show off my babe like champions league trophy	positive
but all these people that went to the airport to welcome bamteddy where una dey when people dey vote ‍️	negative
i want to do so many things in this lifee but na money dey delay am	negative
i dey use god beg you come do give away for me please e don happen egungun don enter express + weeks ask for akant number biko nu	positive
people can lie sha i just woke up and im seeing abortions kunle ‍️ abeg how many children follow your womb come wey you don abort for one man it is a wà	negative
pls and abeg make una stop the im tired of m my sperm self don dey finish abeg pity us	negative
omo see wetin buhari de do for this kind heated moment baba de commision keke how this buhari take survive this corona virus how did he not diee this guy doesnt deserve to live	negative
lol me na those advert dey vex me pass	negative
make dem no go try pitch fela kuti with ronaldo as the best football player e go shock ronaldo self naija wey no dey gree for anything	negative
hello is this how mikel or the entire gonna bring back the world to the this one wey dem jus dey fall fall for ground where dem confidence dey na na like this dem wan take face iceland	neutral
dis is getting real its as if dis type of luck is not meant for my village people abi the thing dey get routine‍️‍️ god abeg e no go better for money	negative
today na today o i don jam this one why ekiti govt dey restrict movement na this one pass my power today o set awon jaruma	positive
na wenger make me stop to dey go the embarrassment of of hearing rival fans taunt you with one by one them don dey go when bayern is leading	positive
whenever sensitive topics are discussed here some people tend to just be stupid just to gain followers god punish all of una wey dey do that	negative
na so e dey start nobody deserves to be treated bad	negative
abeg where una dey see this kind love	positive
shes and so wetin dy pain me pass rn be this young rich bro who committed suicide because of false accusation on rape twitter shey na like this e go dy go ‍️	negative
even if you dont know what to tweet to help during this time atleast copy and paste from verified sites and tweet surprise us small na copy and paste no dey kill my guy dey useful	negative
i love how you can see the future and all possible outcomes well done mrs strange me i just dey talk wetin i see sha i no fit talk pass that one	positive
the kind wahala i do today my body don dey pain me	negative
baba when this credit alert blessing go reach me na abeg people wey don get borrow us una prayer manual biko i need am	positive
i have the prettiest and most sophisticated clients see fine girl na customer appreciation ️️ bag from us stores enugu nigeria	positive
una get mind for this app o so even as i carry trumpet announce say today na my birthday nobody fit just wish me happy birthday its alright keeping my comments and compliments to myself from here on out ‍	negative
after this whole valentine don go and e reach timemy nearest person to show love na i love ya	positive
make me regret not moving you as i was moving to take my place as a marlian oh now see you seeing heaven and i gotta wait till weekend when im less busy when before na one dm wey sound like bro are you back real inside life	negative
upon all the evidence wen we dey see for social media baba still beli say na bomb and im the illiterate o say where are the fragments of the meteorite of to say na true meteoriteand im like but bro people already encroached on that field nowwe wont see it immediately	negative
e dey pain me my hard earned gone like dat	negative
dey there dey form senior man when the love of your life dey ig dey write hookup only	negative
sometimes all you just have to do is to lock up and smile no be say you weak or you no sabi wetin dey sup but e no just worth am	positive
as d week don dey round up we wan use dis opportunity to say big thank you for joining us today on d with our ogbonge host we appreciate una if you join us today which of d top tori catch your attention	positive
what is these peoples problem sef now now dey don form swat but our demand was taking a process shey we are a joke to them in short ehn ‍️‍️ did we say we want change of name ni ‍️	negative
so because i dey use prepaid meter i dey use torch dey move around even when light dey poverty bad even in lebanon	negative
i know if i try to hug or peck my mum ill definitely chop hot slap as a typical katsina hausa woman but i still miss her and i just want to hug her seriously rip mother yaa allah ka bani mata na gari that ill be hugging in moments like this without being slapped	negative
made me a millionaire how i dey work for he papa abi e don dash me kobo before hes very stupid	negative
abeg no vex how can i ask a girl out on twitter fine girls full this twitter oo shoo the kind fyn fyn profile pictures i dey see ehnn any tips on how to toast a girl on twitter	positive
wow im not even team gold but im soo happy for them like say na me win the money	positive
april don dey finish oo i never see post like kings and queens are born in april wetin happen abi coro don collect una crown	negative
cc ur mans market don dey sell	positive
one of its kind perfume oil wey pass perfume oil any fragrance wey you want please retweet my customers fit dey your side	positive
abeg im a sweet guy any gathering for me na blessings no be curse	positive
small moni lafia guys geh dem don run to abuja and geh married dere sheyb us wey still dey lafia we no suppose enjoy bah	negative
wizkid wey say no stress nkou knw say baba no like stresshow e go con dey get light	negative
okay na bro but go fit too i don dey teach am some one or two	positive
oga lasilasi bbybikonubless me too nawna since na e we dey comment too ooi know say naw randomlybut just see me	positive
dis my voice tin don taya mi ooi ordered some fabrics online delivery guy called he was outside told him i was coming got to him nd he says who was i dat he cant give d fabrics to midat its a lady he spoke tosumbody cannot ve fine voice in peace ni	negative
shey e no better make i dey my papa house like this they cannot lock me in that prison yard for months oo i fit crase	negative
you see all those slay queens wannabe those ones wey go dey chew chewing gum like say na hot swallow fear them oo especially the ones wey dey wear sunshades them sabi fart for africa im a victim	negative
that guy done use the money carry arsenal to win yesterday e come dey tell me rubbish now na on sight if i catch am	negative
so so many thing mehn i play different instruments i play different sports i come sabi maths and physics i come sabi sing again i come dey style people again i come dey think like bill gates list can go onn	positive
in all honesty eh that your pinned picture no day wey i no dey look ham i lost totally when your tweet first came to my tl im like what	positive
me go sha dey chop free kilichi dey go	positive
lol this guy just said na my family dey control ogun just to threaten someone lmao im tired of benin city	negative
these girls must be drinking some special kinda water down southloving this glow loving this sass chai roast us small small with dis una swag abeg we are your sacrifice chai	positive
person wey crazeman don bite bwen e see mechanic dey comena once e dey take off	negative
please im the hoe if you know where gold dey let me know make i go dig small see food chop abeg‍️	negative
i won dey see money from where una dey see money	positive
them ask usto drop these two courses say na elective and carry that say na hin be de core now dem dash us those courses wey we no carry and come talk say na them be core again fgs if not abu where	negative
damn im listening to this jam and im like oh sht the gbedu e tight gan	negative
everything dey na just you and your atm we dey wait forthank you bro	positive
u min say leicester don score dat mins my ticket don dey enter small small	positive
this album is fire you just gained a fan youre addictive ive been avoiding this album but e choke me today now im stuck on replay	positive
na the only problem be that dem be my kryptonite dem dey easily catch me but i no fit fall again laiye laiye	negative
if dem born you for nigeria automatically life don dey ahead of if you come fall for poor family if you come be first born paddy take life jejena money dey make normal problem be like spiritual problem	neutral
so parrot dey kiss woman na him some useless people dey do gay tofiakwa	negative
but if na man dey touch woman like that na harassment	negative
the next days is gon be fun never been this excited before una wey dey go leave before dey enjoy oo	positive
exam next week monday and i dey post business steady i sha must chop go exam hall na pls patronise me edakun dont let my post this period go in vain	positive
i just dont like when people promise to get you something and they eventually get it but to collect the thing go be process its either e no dey pick phone no dey near am likee can you just drop it with someone let me come and pick it by myself	negative
baba i swear to god even if i were to be a senator i wont even near those dss operatives you see wetin dem palm na who dey alive fit thank god for life o any pararara na fts under the ground	negative
coach shay you will enter and play the rest you just dey say calm down since and dem dey flog me	negative
is like people bought new cars in this gwarimpa the kin traffic way dem dey get these days e e e	negative
last month bcus dem use iphone colet my baby wet i don dey save for years and i still dey cry now too‍️	positive
the one i had that generated the malaria inside me im still battling with drip + injection currently maybe na god dey punish me sef god biko free me i wont do it again for the main time	negative
e be like shit of cow wey dey purge	negative
tweeps tweeps tweeps i call una wetin they happen now i don reach like years for the twitter ordinary k followers i never celebrate just now now just right now motara create acct e don almost enter k plus oh god of followers take your people to my follow button	negative
na biscuits dey inside coaster now ahh please we need to vote buhari out tomorrow plis i use god beg una go out and vote	negative
baba i get work na why i no talk anything again e dey pain me walahi	negative
i be repentant thief oo the meat wey i dey steal for pot i don repent since bless your boy sir	negative
be like say this woman dey check out my teeth before dishing my meat every goddamn time i buy food na bone she dey gimme	negative
na the work wey we dey do we give you an i want more experience with our beautiful and yummy cakes send a whatsapp message via to place your orders ikorodu	positive
am calling out someone soon that person woke me with fake patronage this morning i dey vex oo	negative
choke me daddy but she no tell my neighbor say she get asthma na there we dey like this dey settle	negative
dem de ment they wanna give you bad energy say no to that apply more nenergy	negative
right now na new president me and my guy dey trek for road dey find so	negative
so because na year end na why i go work kill myself ‍️ to think i will be working late today again auditor sef don go holiday wetin come be my own sef	negative
to god be the glory i don dey add weight oh now na to get six pack remain	positive
when sarz said thats cute and then played a mad jam i felt bad for shizzi e call person hard work cute	negative
video never come out everywhere don burstif nor be grace abeg tell me wetin e be	positive
na dream shank just followed me im so emotional im so grateful to god for making me withness this moment	neutral
this your header wey dey look like prewedding picture your own wedding fit dey this sunday sef	positive
adverthoussena the place where we go carry your business go reach persins wey want am no be only that one we go bring out that better talent wey you getcome teach you how you go get money no allow this obonge opportunity waka pass you	positive
liquorrose wey no fit handle liquor be like gordon win am oh	negative
i had to log out bro even for our streets dem de drag me dat time if i banted bout bb den by now i for b in em memorial list	negative
i swear jide read pass me for that exam i was too confident like wetin baba wan set wey i no go sabi baba sly me	negative
see as sanwoolu dey chance me for eko bridge ahh suffer dey this lagos i dey comot	positive
nobody can fit your position in life all man has their role to play so be the best of you anobi bushasha is here who dey who dey on set of mediator the movie as dir by	positive
na wetin wan keep person na im you dey find	negative
wetin psg dey do no dey moral again na	negative
praise go dey wank if e see small skin for movies i fit bet am	negative
aswear e no go funny wahala sef don pass the money them go wan pay you	negative
futo babes ‍️ you sha not misbehave with dem cause dem dey burst bottle	negative
nina youre vexing me miracle vex na if you want to vex vex with the straightest demonic face ever lmfao	negative
i used super apetisleep no gree catch me insomnia don see me finishi don die	negative
im gaining weight aswear na mosquitoes dey suck am back	negative
subhanallahi i guess dey no fit walk	negative
now wey i need your help you nor help me the time wey you go wan come help me i nor go want your help that time so you go get out by then	negative
where do u buy ur longrich toothpaste abi una no wan carry better toothpaste brush una teeth with longrich toothpaste say good buy to teeth extraction and pains toothpaste g = g= delivery available n lagos	negative
i won talk say e don tey wey i see this guys tweet make i ask if hes okay alaye don block me sha	negative
mans brought out clothes for hommie to help him wash i wan act like say i wan help wash am i know him go say leave am buh my village people fit cast me him go pack am gimme	negative
asiinnthe thing dey like f pitstop wey dem forget bring fresh set of boots	negative
wahala be like broken condom e don leak	negative
lmao na law school abeg we don get marriage order ope first collins last	negative
na the number of foolish people wey dey the replies dey surprise me abi na sarcasm	negative
whenever i see fine girls picture on the tl i retweet and drop a comment sharperly sharperly e no easy to be a fine girl abeg	positive
lols see wetin i pick but e madt ghan	positive
my broda na so e be when u sing along dem go say u dey form sey make u play soapie im like what happened to some lay back relaxed	negative
you sef you dont have joy and romance sef its village people and sars shot that should deflect in your life not my own shot	negative
yes it shouldnt be like dis sometimes i wish i can just phase out everyone in dos parties and dey retire from all dis politics thing then also make the two parties banned	negative
guys today a girl fine girl wey fine reach meal on a hungry eve gave me her iphone pro to help her hold it till she finish drinking water i wanted to run but na for motor park we de i no i go chop beating sotey i go wish i die	negative
go tell god that one na we say make una like glittering things if not we go for still dey paradise now	negative
na this kain thing i dey enjoy i swear	positive
e go be like say na kerosene i dey drink	negative
one problem i don get since primary school i no dey hear word and i dey chop indomie sef e no do chop again wahala for who dey chop beans that time o	negative
hows your family na hin i dey wait for	positive
after them don kw me finish na dem go come like me pass anything o morning afternoon and night hello ibk how r uam bored i lets go out ask she go tell u how sweet of a person i am abi u no like me	positive
hold on na this same premier league i watched abi na another one wey people dey tip kante for player of the year ‍️‍️	negative
same as me but i have more than enough to last me than stay up at midnight wen i no gaachi	positive
rich celebs buy ugly cloth anticeleb this cloth ugly tbh fans na because you papa no get money to buy am anticeleb i no fit use my money buy this cloth na fans because your money no reach am fan to his inner self but why my fave buy this kind ugly cloth	negative
strongly feel like going out this nightbut no bae economy car no dey move everything just dey wan kain	negative
na una get the company na make una leave us with the upgrade na rich man suppose dey complain ‍️	negative
aubameyang dae surprise me e be like say e wan leave my club because even an injured player could outperform him today	positive
oh my goddistance no be anything but this one wey strong men don dey road	negative
see wetin i yarn that time someone got those hotels for don record u handed over bodies to soldiers way dey shoot	negative
anyone that might have seen me earlier today must have thought that im crazy no dear na stress wan kill me	negative
see person wey get money	positive
wetin do my hands and legs wey i no go fit enter kitchen myself happy sashing ni lootolol	positive
ordinary dog i no fit buy in peace make we no ham nii oo ft hrfceo tegvoc cc mannynations officialefresh thecuteabiola iamomobolade yabaleftonline gossipmillnaija	negative
lmao you bin dey tell me small small but na you worse pass	positive
omo dey cook abeg im not saying this because i like spaghetti the food make brain kindly patronize my bestie	positive
on saturday them bring am o i say i will give them mins to be sure they have made up their mind on giving us power after mins light still dey i happy go off gen as i enter house wan siddon light fiaam which kain we get for agungi sef	negative
frankly i dey enjoy am cuss no dey pain me at all i be warri boy wey go military school cuss na compliment	positive
why you no blowchuk hand inside dat bastard eye this is sad my gender keep shaming me	negative
so person no fit dash me k	negative
baby its not like dat na you know i love you tori tòrun	positive
you no jam am during the scare period which kain drugs i nor prescribe for that boy at least e go dey see skyscraper for where e dey now	negative
na my ticket dey me important pass you people should not beat dem more than o	negative
people wey dey carry this pose dey like amebo die	positive
omo you dey yankee still dey say make i dey pay you monthly salaryagain i have useless friends	negative
fuck up i need una to go question dis and ask grammy y de posted this coz if na wizzy b dis we no go hear word for fc hand am so disappointed in fc like dis is what u guys has been thinking all this while fuck wizzy didnt liked bb congrats at all but we didnt act	negative
this team don good abeg madam abeg gimme fearless	positive
na all those kind guys for exam hall wey go ask you whether you dey sure when dem dey dub	positive
mine was in jss the person wey help me use carton design greeting for christy na e by himself use him hand go show our class monitor mumu charles carry the card go show vice principal vice principal na deeper life pastor las las d news reached home before me i colet	negative
i no dey find their trouble i just dey face my hustlee see but when i start them go yinmu then them go start to dey love me ahh spiritual am highly spiritual birthday blessings baby boy for life	positive
aswearrugawd i just dey hear am you be pitakwa geh na so na una get all these pidgin proverbs but i like as she talk am based on or	positive
oh na guy u be sef and ive been calm with my words thinking im talking with a female alaye if u dont get the fuck off from here now eeh	negative
so im at this house opening ceremony at onitsha mehn d house dịkwa bloody chai soso entrance door bụ mil naira frm tokyo pure bullet proof mbia banu parlour mehn e be like say i enter anoda world e fine pass office if to say e fine ihu tv bụ mil	positive
so i guess america is poor as well for asking people to donate as well sometimes una no dey think and every na joke to una ki o to de fi la si ori bi apeja	negative
i dey vex say them scam my guy you dey tell me say your name na jenifer happy birthday quennyjoe more life cc thysquarenation ft and quennyjoe delascollections	neutral
debonairs gtgtgtgtgt dominos so na wetin una dey enjoy for this lagos	negative
wahala be like bicycle nah jeje i dey wey u drive ruff with ur mouth come my tweet ordinary for agbawoli to wash your head for days you blocked me just lai dat how we go solve this your problem now small play oo	negative
person give u a twerk video una dey tell am say make e delete am e no good o	negative
for this person now man utd playing beautiful football no concern am na just to win and thats what jose does as a chelsea fan sef im worried	negative
kayodee why switch the camera na na this kind mood dey result months pls go back to the hoh lounge	positive
abeg abeg na only me dey sleep wazoldis	negative
you sabi wetin i like i don see am thanks	positive
u dis guy u are not serious again na my presido u dey reason like that ‍️‍️‍️	negative
tomorrow but you no fit celebrate because you dey your papa house	negative
theyre confident if they want to toast a lady theyll be like baby wetin be your name come i go give u anything u want in fact how much u go fit chop	positive
thank you all yesterday was awesome and amazing and you people made it so for meyou came out in numbers to wish me well and celebrate mei wasnt expecting that but i was shocked i also got new followers i no dey always get sense ohi fit drag u anytime im grateful	positive
lol im good maka we suppose link up òoo e don tey	positive
to make it and im certain that im marking this one because e don sub + again lazio scores again to make it imagine not loving the joy and suspense footbal brings	negative
so for the full nigeria them nor see better camera take snap this thing this ahmed musa una sure say e dey alright so i stil dont understand this decision to join kanu pillars	negative
a letter to my ex dear miss amaka you been tell me say ikechukwu na your brother all those years only for you to invite me come wedding come see you dey marry the same ikechukwu my chest still dey pain me till today for my leg and my abdomen region	negative
swipe boohooman tie dye ss tshirt out of stock shakarashop online shop wen sabi you sef go dey do shakara warri nigeria	positive
wen u go dey jolly for beach head no pain uwork don start nowyen yen my head	negative
