tweet	label
na why i dey ask abuja when they fit cheap like this	negative
cows man fit start cow business add obi anachulu efi to him title na people like then dey make people no dey like go village	negative
las las na akon cause this see finish for him self why u go feature nigerian artist so tey e even sing with bred if not where mi for take see chance misyarn like dis	negative
he be like say i no go dey enter this justrite wey dey my area again na soap i one go buy how my hand go carry wristwatch i no sabi i don pay finish before the charm clear for my eyes	negative
this midfield go make sense e fit carry us for the whole season paul pogba bruno fernandes fred scott mctominay nemanja matic donny van de beek if anybody woundjure we no go feel am	positive
i dont think so me the like i like wizzy all hin song i sabi am e get some music wey i go play for wizzy e go shock wlh allah	positive
my youngest sister don pack all the airtime n she dey her room dey laugh like agbero ‍️	positive
caleb university babes dey knack fire fear them them go knack you till you cum blood like say boys no dey the school ‍️ make babe dey tell you say youre not that strong in bed after four solid rounds ‍️ if she tells you faster fasternigga just pull out and go home	negative
abuja fun spots wey dey get hefty bouncers die abeg we need you to speak to your staff to support us with their strength	positive
part of the money me na i say okay no wahala enter when i reach where i dey go we go end trip see how much then you pay a percentage abi no be so i don reach where i dey go finish aunty oya pay she say em i dont have cash with me ah ah see me see cashless society	negative
lmao shey na cuddle the guy wan spell or what e say cudull	negative
picture is even better shebi u go change cloth na nude dey tire me oga is the same bress u saw yesterday na still the same yansh nau	negative
this tl no fit off me this morning thank god say na catchup i dey play because too many stray bullets don fire see as shell dey ground	positive
the kind lie people na e dish na this twitter na agba mụ anya mmiri makachi people can lie oo	negative
i dont know what im doing wrong im not selling im broke im sad were almost in december baba god i know youre the god of the th hour please come through	negative
abeg make una no verse for the kind curse wey i curse una yesterday i no know say nah whatsapp dey down tbh	positive
so payint dey for n see why this life is not fair you go wan buy a pair of calvin klein boxer briefs dem go dey call k	negative
i fit deck this guy for my office ahh	negative
lmao this brt don climb bump sotey breast don commot for bra	negative
e no see money to buy cream again chai buhari don suffer dem ehn	negative
the hate for this industry too plenty we gat look for land put am we no fit live for same land with haters	negative
that one go come afterwards for now na the one wey go use enjoyment finish me i dey find	positive
ah e don electrocute her	negative
una wicked oh make una wish good for our country for once nah person use fone record una de attack nta	positive
dont do me like dis nah make i see d video st e get d way take narrate d video wey i won see	positive
baba don dey torment us with im jam chaiimake i increase my speaker abeg	positive
wahala dey o my girlfriend say na she dey lead praise and worship for her church on valentines day and dem dey do vigil till monday evening abeg shey na lori iro or i should calm down	negative
abeg who get owambe wey person fit gate crash today na	positive
lmao bro how we go do na i dey test this big man life e be like say the thing go fit me abi	positive
una don dey overdo am for the benin city which one small pikin when never reach dey do for hk make una calm down chairmen abeg no go spoil smallie life because grown up boys nor dey loyal again shuoo wetin dey xup na every body must do yahoo	negative
una no dey help me ooh with all these delivery ooh like i just stay indoors everyday except to go to work church market or park na wah oh	negative
azzin abeg no dey pull my legs dem no too strong like that	negative
sme pple dnt take it p wen u dnt flow bk too bad im nt of dose pple if u dnt flow back in days im unflowin ya ass	negative
small sickness i don dey chop like thief o wrong na	negative
fine girl wey dey chop mouth	positive
na clitoris hin wan talk vagina ke vagina usa tweet ur location	negative
wetin man go chop like this its as if im tired of the whole food in the world and im hungry	positive
so sun fit comot after the flogging rain did me this afternoon	negative
yess me im dancing now sef and you too yoma	positive
i broke a sweat when i saw your post had to confirm no wahala sha e dey happen to even the best of us	positive
whoever is in charge of adigbes light e no go better for the person and hin whole family	negative
person father die this ones dey say make dem stop to dey cry	neutral
congrats fine people god bless your home na dis kind pictures dem dey make me wan do fast go marry	positive
me sef shock oo thank god for my brain sha	positive
i used one of your atm gtb for ekenwan road benin city branch withdrawal today i was debited and didnt get paid i still havent gotten a reversal till now abeg make una reverse my k nor be for this kind economy person dey lost k	negative
e get stage wey person go reach for life wey sex no go dey excite am again d only thing wey u go dey crave for na peace of mind and financial stability e be like say i don reach that stage ohh i just want peace of mind n more money	positive
baba don jazzyplease nahgimme money tooplease nah abeg nahna beg i dey beg	negative
i thought of it too and got disappointed when i heard he was putting akonguyy i wan crybetter song like that you dey ft akon i just dey imagine davidowizkid or burna boy on that song guyy	negative
my phone camera just broke my heart i snap picture n my oga called me mr tycoon u looking good this man does not know na camera iphone dey help my life top league for this girls heart so this man no go wan help me again oh	negative
the way your network act sometimes can even make some one use provocation tey scatter e phone god see as network dey frustrate people why today all of night	negative
na small play oh e dey twist am like say e dey pick beans	negative
e be like say na the whole abuja dem carry light o kva transformer is down at the moment me thinks	negative
the one wey off me last year na one babe wey dey fully date two guys and leading like three other guys on dey ask me for money shock hol me so tey i wan ask her what about em mandem wey dey at her service	negative
my dear elozonam no fit give us as usual cause of enimoney	negative
pesin dey know right from butchering ram say the meat go sweet or not between dis kpangala and finals i just tire	negative
credit to iamkingrudy trending on youtube worldwide link on my bio dear dem don dey reason with me repping uniabujagwagscity federal	positive
f u t u r e i n y o u r e y e s is a project im super proud of and it simply reflects my heart felt passion towards what i love and im grateful to and rhymebamz for	negative
we got home and mumcy was asking what was wrong iya sha lemme alone ó with cattagh coming outta my brain im going to bed ahan its just past mumcy said wont u drop the drink in the fridge she continued ehn drop wetin na my pillow be this now o sha leeme alone	negative
na the joseph for bible wey them lie on top of his heard say he wan rape portiphers wife lie about someone no be fake news or that no qualify to be	negative
e still dey pain me i dey feel like ano go sleep	negative
god bless me enough i wan chill my family oomy mates wey de do am no get two heads oinshallah we go ball na samll remain	positive
so dis housemates nu fit sidon eat dis chaw ‍️ see as sir dee n tacha pack tins lik say moro nu dey	negative
the work my mama gimme today you go think say she don mean me like say she set trap for me as i no dey come house work continues tomorrow i don tire abeg	negative
is this not that guy thats using wan accent like that at him don get naija accent now o and him don dy wear trads	negative
my love for the back of this top its magic na the work wey we dey do	positive
lagos people make una leave burna boy for a while why una be like dis nah	negative
de bruyne is playing lb pesin wey i cap	negative
no b only u guy my eyes dey act like say we slept during the so no qualms i need sleep e no wan come	positive
eh leave the cars for arewa twitter na dem get all the connections in this country my very concern is as i short that their outfit no go fit me	negative
make i wear mask for inside car again e dey bag	positive
e dey everywhere for nigeria during the construction of road for one of our houses dem demolished some parts make we repair na him dem bail us die	negative
baba turn a whole contry to babe wey dem dey woo allow me to prove to you that boy if you dont you want to use us to collect extra sheet that you wont use they will waste your time they will prove to you carry your desire and go abeggi	negative
lmao you don join dem too na wa ohh	negative
fine bois like us we no dey too fine woman like that na den dey rush us	positive
when i tell chelsea fans dat when kepa starts it means we are goal down already e go be like say i just dey hate let us enjoy our kepa	negative
try dey smile e dey neccessary	positive
wetin una dey talk wey notification be like group chat messages like this	negative
mini bus dey oh few cab wey dem go pack una like sardines	negative
i no fit if i dey smile	negative
hahahahaha na dem wan stop me from blowing	negative
this go hard oo albino go throw e neighbor pikin up but e no come see the pikin catch again we still de settle	negative
youre a chief na see the kind picture wey dey your dp	positive
stop to dey thief person tweet without giving him credit shame no dey dey u	negative
ozwor na we wan tell you weda you go stain yourself or not abeg dey go e draw if you wan draw‍️ draw draw	negative
lol bpy na fear you dey and i understand because according to your logic person no fit enter ashawo quarter come out alive but here i am twitting insults at you so your logic no correct if them born you well abeg come that your hand go bend mumu sha show	negative
lmao attempts na fulham dem dey play against	negative
dem b useless people dey just dey spoil my tickets i cant carry winning for utd again	negative
not his fault na our people wey dey encourage him	negative
woss wobi pls can somebody help ‍️ wetin dat guy do mourinho wey make baba vex like dat after dat chelsea second goal	negative
i dont only play piano i play guitar too i sing im a performing artist im a song writer im unsigned im scared of ending up locally but im proud of what of doing it will take me globally someday i wish its soon	negative
make the world just end if e wan end abi which wan is this hell lite we are currently experiencing in this part of the world like ds	negative
maami support me na see as dem dey attack only me	positive
when i wake up am versus when i wake up am na me dey make makeup fine no be makeup dey make me fine × my baba and mama did good	positive
my friendship i say insult follow the last money wey i receive to think when i was giving it na so so thank you god bless you see am now the money don useless kai	negative
where una for dey see this money take dey buy car for una wives namake una show me na	negative
ramadan day prayer dear god shebi na dem talk say there is light at the end of every tunnel abeg wetin come do nigeria own cos e be like say dey don cut am oabeg help us confirm if light still dey abeg cos we don dey waka for over years now	negative
cent na beans for battle rap e be like you no know wetin you dey talk my friend comot for here jay z lost to nas when dey beefed hes not really a battle rapper eminem and cent started out as battle rappers theyll make hov and cole cry with lyrics they dont care	negative
it was glaring and obvious that the likes of muller hummels were actually beefing leroy sane and started talking rubbish about his attitude in training envy go finish people for this world onto say small boy wan rise una wan run quench him fire las las dem pursue una	negative
nah on top car them run my birthday yesterday but it was still fun omo highness fit kee me	positive
i always picked a quarrel with people dat disrespected my bamteddy dat time it was war for mewhat our faves will make us doi guess some people thought i was d most disrespectful person dey ever met then	negative
wahala be like nigeria e dey paint pesin black	negative
girls that will say she is celibate and shit my brother na lie dem dey shook am in and out bruhh won do gidi gan na u be the mumu for the film bruuhh	negative
i love you guys getting a jersey soon even if na road side own sef	positive
blood of malachi see as zambia just wan tear my ticket algeria dey house dey play like visitors	negative
whats this nonsense we call traffic sef which kind wahala be this na sin to wan go your house	negative
i think im no longer omo iya e again oo cos you just dey air me	negative
weekend came early i design engagement beaded jewelry for couples and we dey set ham well make e sit kampe on outfits kindly help rt my customers might be in your tl thanks	positive
we dey fight for a better nigeriadis werey dey here dey do him own evil work e sir we re coming for u soon	negative
im sure someone is already writing speech your president will say now president wey no fit talk without looking at the book is that one president abi folorun shole	negative
me i don send out deliveries already i dey bed dey enjoy ac come let me employ you to be frying puff puff	negative
my chief i dey tell you mehhnn dem don do me strong thing cus of good heart	negative
me i no dey like dey follw una argue for twitter make we drop location meet do wetin we won do not here twitter jackie chan	negative
e too sweet abeglike things ehif pastor ask me for special number now to drop some lines oo na this cruise na we need oo e day enter brain pass some pastors messages	positive
e get any player wey u no sabi sha u dey try abeg	positive
its not even bout nose mask dem don dey run am since na worse dem go sit for seat in front of you backing you with their extensions breeze go now finish work ‍️ for people like us that dont do breakfast before work hay god stomach go turn person till e drop	negative
omo if car na wetin person dey vex buy i for don break bottle go buy	negative
if person na arsenal fan abeg e dey cause mental disorder	negative
cute me na dem dey rush us	positive
na wa o if what im seeing under this tweet is true my wife go hate me gan o cos im too lazy cant even get myself food	negative
you sabi cook you sabi cook but you sabi make pap	negative
lmfao abi thunder wan strike this oneso na pm be your resumption and me dey resume am	negative
enjoy wetin now na ac i wan chop abi na seaside	negative
kids wey don sabi twerk like that theyre potential slay queens wetin dey pain me say i no sabi which state or school dem dey	positive
yes nayou no see say na when em don chop serious beating nai strength from nowhere go cum kill kill dem	negative
i don carry mat enter your dm its like it is there i will sleep e dakun e reply message mi	positive
na dem go promote oyinbo fun musicfilm but go downgrade nigerian one na them go feature oyinbo oyinbo no dey feature them na them go watch oyinbo oyinbo no ho watch them yet them go they claim celebrity upandan like say heavens seat dem sidon if i hear pim	negative
four years don waka thank you lord journalist di egwu	positive
you guys are next na beg i dey beg oo make una nor near my area oo because light we nor dey see use	negative
im sure you guys had fun but youre not showing me pics of the oba na all these men with big belle you dey post	positive
leav dem make dem just open mouth cos they sabi talk	negative
wetin be suv na poku lowo bi dis ohbend down selecte popular for nigeria baje baje	negative
nationwide abi na una wahala make i download porn now	negative
and na leo tobi lolu and ifu like they form se de smart and de still never solve their puzzle	negative
tbh im so chilled about my husband because i know god has the best for me im just working to be equally fit for him	positive
hahahahaha wat rubbish news dis by dis time of d day am in pains y am i born in dis country yy postpone election by dis time of election eve	negative
i no fit if i dey smile	negative
make i send u gps to k house na there e de happen	positive
una nor dey update for aftanun abi na us work una dey do	negative
you wey originate the question nko o but na good question sha make you try cc me when u don get the answer	positive
and don collide ontop my mataabeg una sure say no be sub i come this life con sub like this	negative
my people no dey disappoint	positive
my man just air before naira go cast he btc transaction wey e don dey arrange since	positive
like this like this ehh benin boyz no wan hear o dem say buhariust go oo any body wen see buharibmake e tell am oo make e fit run for his life o	negative
watching prison break the thing just de confuse me anyhow i just weak	negative
make una help me ooi don put hand wey i take blend pepper for my balls when peeingim burning now	negative
nobody should come to abuja again e don full dont comma disturb our peace	negative
new designs fine shoes like us we no dey rush customers na dem dey rush us retweet	positive
i go leave betting for una if this odds no play don baba please balance my account because betway don finish me patapata	negative
mehn d guy na king️	positive
lagos and zamfara on d way a beg na plane una dey use abi jetat dis tym	negative
guy i go dress for work once i don chop am na straight back to house to let em digest	positive
its only when im talking to someone i like ill now be slow hell now think im a mumu	negative
arm robber dey rape landlord wife prick comot landlady put am back nah the matter dey table like this oo since am we dey there dey settle the matter oo	negative
na wa o see how dem hug as if say na fight	negative
i just dey smile anyhow omo e no matter if you be the best o just dey do that thing wey you love to do dey go everything go soft las las	positive
its look like you just got ahold of this endearment e dey sweet you for belle well well sir	positive
waking up to dis cuteness pikin wey fine like dis ️	positive
hahahaba mana try and trust them we fit win o	positive
fine boy like lingard and i no dey loose guard getting all the california love like im pac i have not released any rap song since i dropped jeje on my birthday but im coming again maybe my next song and maybe not be on the look out	positive
lol tgis anti corruption package nor dey tire una we don wise pass that level e nor work again start doing it with your achievements asap las las na daura loader	negative
once stepped out to buy stuff the girl say around yrs i met there sitting with her mum i addressed her as lady mama change am for me oh shes not a lady na so una dey take spoil peoples daughters shes not a lady na girl biko ha	negative
wen i yarn wuna make wuna pay me so dat maka wash ajebo comot from wuna body and teach u beta pidgin wuna bin dey behave like orpioro mango ‍️	positive
if you no fit dey accountable no stay front abeg people tend to expect more from you if you go complain abeg shift go back jejely remember why moses missed the promise land and learn	negative
as you dey buy gifts for your girlfriend abeg dey try buy for your mother too god bless you my son still better pass awwn baby	positive
who get phone wey e no de use again my phone has spoilt last last the screen be like e de high dey touch here and thereyo type this tweet na war epp	negative
so i slept off and many things happened when i was saying stop shipping some were calling me bitter cruise on this show una no dey hear or hv a fav anywhere his or her belle face u follow it wil end in tears david is the ultimate scam for now next	negative
f e e l l o v e d they re awesome and amazing	positive
whats wrong with this people sef haba lets us eat food finish	negative
hey bunny see all these hustle wen i dey do na make we fit dey comfortable make all these small small boys nor dey worry you when i blow we go use them do yeye never goes wrong	positive
e no easy	negative
e no just work for me	negative
lmao dey behave like person with tumor wey know say las las den no fit comot am sha las las go bald	negative
its ok bayern una too dey vex sef wetin dey work una	negative
if babes de type come de put plenty lol or emojis just know say e don pain them enter kidney	negative
biggie jut like dat how many weeks dey don use waiting happen	negative
e no get who no get him own wahalaeverybody just de smile de waka jeje so if person no fit helep you todaynwannem nwoke nwanyi understand and move on if you continue to worry am and him block you patapatae no mean say him wicked o e only mean say you no get sense	positive
na that one dem dey see you fine meal oleey	negative
you go dey ok	positive
kiki osinbajo should just go and sit down abeg they dey find her papa for oshodi oo make dey no catch am oo it is like they dont know people voted for osinbajo not buhari not knowing that the difference between osinbajo and buhari na just age and height	negative
ndidi na rugedy babai like him always a nuisance to the opposition i wish kelechi can get a goal in this game e don try	positive
man o man beautiful girls choke this twitter o ahh my phone don dey lag cos some of the photos dey heavy before loading bless you guys	positive
e be like say e don burst	negative
my chief i dey tell you mehhnn dem don do me strong thing cus of good heart	negative
boboi wetin u dey do no good u dey share money for peoplecom dey side line me o need gbogbo eleyi now	positive
lmao i been dey run up one invoice wan come start to dey lament about the bar when the thing hit me	negative
na here dem go see gf she don quickly like the tweet	positive
omo cos them don sign now them fit dey rest me i dey hustle	positive
wetin de there to pay person na kk na wa for u oo	negative
i take god beg you i never see k for my lifei wan dey gather my own small small abeg check my media check my fleet pick something help me retweet let god use you abeg	positive
the number dey dia call me also you too fit believe	positive
one man was watching football with her wife and their son for one lounge like that madam say she wan go house baba say make she dey go na omo come see small marriage drama	negative
on top this valetine na so my guy propose yesterday oo love is sweet which way now i dey propose next week oo i don leave una geng	positive
everybody don wan start twitter hangout like this at the hangoutsingle ones like us go dey hang around as for twitter for android we go hang ourselves	positive
una don dey claim class on top app of mb say na they dont have access to it poverty don finish this country walai	negative
as in the guy brain dey there	positive
make una dey try make the zobo cold before una dey serve am ooh wats all this	negative
i just want to wake up one morning go straight to aso rock demand to see the president greet him and give him better slap is it too much to ask after that anything way wan happen make e happen i be port harcourt boy wike na my governor	negative
on your way from lagos to abuja and bus stops for everyone to eat only for you to be told bros no be that guo you follow dem don look for you so tey the driver don go o	negative
lol some niggas still dey around dey peddle drugs as match dey go on ahh	negative
i got an alert but i dont know who sent it ah god of umu ogbenyi i bless your name god of ndi ne ewe gi nne na nna i thank you na me you dey look after like this i will always speak of your goodness in my life	positive
hop yall still streaming u need to hear this gbedu use the link above by ft go stream now lov u e no go cost a dollar to retweet u	positive
i toast u and u say no u ask for money i say no or i didnt respondu con dey vex no b persin wey gain add mission dey pay sch fees ‍️‍️‍️ oya u self reason am nah	positive
lol e get d way e go dey do you wey u no go fit hide am	negative
mgpthe police they sayis your friendbut wait make u enter dem handna dat time u go no weda na true abi na lie dis we naija	negative
wen sapa wire u sumtime u no go even remember say u get dick no vex match teacher	negative
boss bless me tonight abeg even if na any amount hungry wan finish me for where ahde	negative
its her stupidity for me thank god i no follow for her people wahala for who dey listen to every advice wey dey on twitter	negative
wetin ur concern dey doif no be footballer na lie bros	negative
i used typical replace extremists ne i was talking a friendxtian dat grew up in minna niger state abt how it feels whenever he visits his hometown imo he was like na boko haram dey call us oh he revealed some shocking secrets but no b my mouth una go hear am	negative
baba dey do high taste high taste as him perceive the aroma of my jollof rice pops you don cook finish me nah e remain small pops i go chop oh	positive
i also noticed that they were getting married to men the evil men and you know the part wey burst my brain dem no dey invite the ones wey dem dey always call my love my boo bestie dem no dey invite the ones wey dem tell say make dem leave their men	negative
aswear o e save her name with mami m	negative
na meat wey nor dey inside soup na make stockfish dey form celebrity	neutral
lol asin ehn i no dey even do that smiling again make everybody know how e dey be me	negative
na morning you for tweet this thing o light no dey here i don look back like three times na who retweet this thing come my tl self pls who is in ikeja help me buy fuel come	negative
